slug,name,cover,title,place,published,metaDescription,content,intro
"stx-next-releases-python-tech-radar","STX Next Releases Python Tech Radar: A Comprehensive Guide on Current State and Future Developments in Python","https://4542168.fs1.hubspotusercontent-na1.net/hubfs/4542168/python-tech-radar-graphics-.png","STX Next Releases Python Tech Radar","","2023-02-26T23:00:00.000Z","STX Next Releases Python Tech Radar: A Comprehensive Guide on Current State and Future Developments in Python.","<p style=""text-align: justify;"">STX Next, a technology consulting firm with a specialization in Python software development has released its highly anticipated <a href=""../../../../com/stxnext/www/pythontechradar.html"" rel=""noopener"" target=""_blank""><strong>Python Tech Radar</strong></a> report. The report is based on a survey conducted among over 100 of STX Next's Python Developers and presents an overview of the current state of Python, challenges, and the future of further development.</p> 
                  <p style=""text-align: justify;""><img src=""https://www.stxnext.com/hs-fs/hubfs/python-tech-radar-graphics-.png?width=1200&amp;height=628&amp;name=python-tech-radar-graphics-.png"" alt=""python-tech-radar-graphics-"" width=""1200"" height=""628"" loading=""lazy"" style=""height: auto; max-width: 100%; width: 1200px;"" srcset=""https://www.stxnext.com/hs-fs/hubfs/python-tech-radar-graphics-.png?width=600&amp;height=314&amp;name=python-tech-radar-graphics-.png 600w, https://www.stxnext.com/hs-fs/hubfs/python-tech-radar-graphics-.png?width=1200&amp;height=628&amp;name=python-tech-radar-graphics-.png 1200w, https://www.stxnext.com/hs-fs/hubfs/python-tech-radar-graphics-.png?width=1800&amp;height=942&amp;name=python-tech-radar-graphics-.png 1800w, https://www.stxnext.com/hs-fs/hubfs/python-tech-radar-graphics-.png?width=2400&amp;height=1256&amp;name=python-tech-radar-graphics-.png 2400w, https://www.stxnext.com/hs-fs/hubfs/python-tech-radar-graphics-.png?width=3000&amp;height=1570&amp;name=python-tech-radar-graphics-.png 3000w, https://www.stxnext.com/hs-fs/hubfs/python-tech-radar-graphics-.png?width=3600&amp;height=1884&amp;name=python-tech-radar-graphics-.png 3600w"" sizes=""(max-width: 1200px) 100vw, 1200px""></p> 
                  <p style=""text-align: justify;"">Python Tech Radar provides insights into the latest trends and best practices for Python development. The report delves into the future of Python, including predictions about the extent to which development will be automated through AI, the most promising libraries and tools for domains such as machine learning and data engineering. The ebook also gives an in-depth overview of the next Python-related hot topics which will empower programmers to enhance their skills and stay ahead of the curve in this dynamic field.<br><br>""Python Tech Radar highlights the continued importance and dominance of Python in the business world, particularly when it comes to data science, machine learning, and artificial intelligence”, said <strong>Ronald Binkofski</strong>, CEO of STX Next. “As demand for these capabilities continues to grow, businesses that invest in Python and build their development options will be well-positioned for success in the years to come"".<br><br>“I’m confident that Python will remain a dominant player in the global business landscape, and that its importance will only continue to grow “, adds STX Next’s CEO.<br><br>Python Tech Radar not only is a resource that provides guidance on the latest trends in the Python ecosystem, but also helps programmers stay up-to-date with the best practices and emerging technologies in the Python world. The report covers topics such as Python implementations, libraries, frameworks, and cloud platforms, helping identify the tools and technologies that are likely to have the most impact in the future.<br><br>""Our goal was to create a comprehensive resource that would benefit both expert Python developers and tech leaders alike. After months of hard work and meticulous research, Python Tech Radar is now a reality, and we couldn't be more excited to share it with the community. We aim to empower managers and programmers to make informed decisions by highlighting the most interesting issues in the world of Python""</p> 
                  <p style=""text-align: justify;""><strong>Paulina Kajzer</strong>, Chief Content Officer of Python Tech Radar at STX Next</p> 
                  <p style=""text-align: justify;"">""We are proud to be at the forefront of Python development, and our Python Tech Radar report is a valuable resource for developers and organizations that aim to remain ahead of the competition”, said Binkofski. ""Our team of experts has worked tirelessly to compile this report, and we believe it will be an invaluable resource for anyone interested in Python”.</p>","Poznań, February 27, 2023"
"stx-next-unlocks-the-future-of-cybersecurity-the-top-4-trends","STX Next unlocks the Future of Cybersecurity: The Top 4 Trends & How to Navigate the Challenges of Data Gravity Center","https://4542168.fs1.hubspotusercontent-na1.net/hubfs/4542168/433_Best%20cybersecurity%20practices%20for%20fintechs@2x-min.png","STX Next unlocks the Future of Cybersecurity: The Top 4 Trends","","2023-02-15T23:00:00.000Z","As the amount of data being generated and stored by organizations continues to grow, data gravity centers are facing unique challenges in cybersecurity.","<p style=""text-align: justify;"">As the amount of data being generated and stored by organizations continues to grow, data gravity centers are facing unique challenges in cybersecurity. Today a leading provider of software development services, STX Next is tackling these challenges.</p> 
                  <p style=""text-align: justify;""><br>If you are wondering what the latest trends and developments in the cybersecurity field are, as well as the concept of “data gravity centers”, the risks and inefficiencies involved in using them, you’re in the right place. On STX Next’s latest Tech Leaders Hub session we interviewed Avi Chesla, founder &amp; CEO of Cybersecurity Stealth-Mode Startup. As a cybersecurity expert with over 20 years of experience in tech, Avi has seen firsthand the rapid evolution of the industry.&nbsp;</p> 
                  <p style=""text-align: justify;"">&nbsp;</p>","Poznań, February 16, 2023"
"stx-next-on-transforming-the-financial-sector-with-cutting-edge-ai","Revolutionizing Finance: STX Next on transforming the financial sector with Cutting-Edge AI & ML","https://4542168.fs1.hubspotusercontent-na1.net/hubfs/4542168/431_Fintech%20events%20in%202021@2x.jpg","STX Next on transforming the financial sector with Cutting-Edge AI","","2023-02-09T23:00:00.000Z","The use of Artificial Intelligence (AI) and Machine Learning (ML) in financial services is on the rise, and for good reason. ","<p style=""text-align: justify;"">The use of Artificial Intelligence (AI) and Machine Learning (ML) in financial services is on the rise, and for good reason. STX Next, a company with many years of experience in the fintech sector, has been operating in this space for a long time and leverages its expertise to bring cutting-edge technologies to financial institutions, making them more efficient, accurate, and profitable. Having said that, it is evident that the integration of AI and ML in the financial sector is driving a paradigm shift in the way financial services are performed, and our experts highlight the areas where this impact is most significant.</p> 
                  <p style=""text-align: justify;"">&nbsp;</p>","Poznań, February 10, 2023"
"stx-next-appoints-ronald-binkofski-as-new-ceo","STX Next appoints Ronald Binkofski as new CEO","https://4542168.fs1.hubspotusercontent-na1.net/hubfs/4542168/ronald-binkofski-(5)%20(1).jpg","STX Next appoints Ronald Binkofski as new CEO","","2023-01-09T23:00:00.000Z","Binkofski will be instrumental in driving STX Next’s growth strategy and helping company access new customers and markets","<p style=""text-align: justify;"">Software development company STX Next has announced the appointment of Ronald Binkofski as its new Chief Executive Officer. Binkofski joins STX Next with almost 30 years of experience working in managerial positions at tech companies across Europe.</p> 
                  <p style=""text-align: justify;""><img src=""https://www.stxnext.com/hubfs/ronald-binkofski-(5)-jpg.jpeg"" loading=""lazy""></p>","<span style=""font-size: 19px;"">Binkofski will be instrumental in driving STX Next’s growth strategy and helping company access new customers and markets</span>"
"stx-next-elected-as-polands-best-exporting-company","STX Next elected as Poland’s Best Exporting Company in International Champion competition","https://4542168.fs1.hubspotusercontent-na1.net/hubfs/4542168/zdj%C4%99cie%20PB%20(1).jpg","STX Next elected as Poland’s Best Exporting Company","","2022-12-07T23:00:00.000Z","STX Next was recently elected as the grand prize winner of the Exporter category in Polish Company - International Champion competition. ","<p style=""text-align: justify;"">Polish companies are transforming into global entities, competing effectively on foreign markets and building the Polish brand on the international arena. The annual Polish Company - International Champion competition was established to promote the activity of Polish companies in global markets, and STX Next was recently elected as the grand prize winner of the Exporter category, among small and medium-sized enterprises. The company's success is a great honor and recognition of their hard work and dedication to the development of the Polish brand on the international stage.</p> 
                  <p style=""text-align: justify;"">&nbsp;</p>","Poznań, December 8, 2022"
"technology-leaders-are-facing-unique-challenges","Technology leaders are facing unique challenges – only a unique approach to leadership will solve them","https://4542168.fs1.hubspotusercontent-na1.net/hubfs/4542168/top-cto-tech-blogs.jpg","Technology leaders are facing unique challenges","","2022-11-27T23:00:00.000Z","Putting expansion plans on pause and re-thinking hiring strategies will help tech companies overcome industry struggles","<p>As spiralling inflation, interest rate hikes and the threat of recession drive up the cost of doing business, tech leaders must be agile, look to new methods of management and be open to rescheduling pre-existing plans. This is according to<a href=""../../../../com/stxnext/www/index.html""><span> </span><span style=""color: #1155cc; text-decoration: underline;"">STX Next</span></a>, Europe’s largest software development company that specialises in Python.</p> 
                  <p>Alongside economic struggles, talent shortages are continuing to expose skills gaps in technical teams –<a href=""https://www.nashsquared.com/dlr-2022""><span> </span><span style=""color: #1155cc; text-decoration: underline;"">68% of tech companies</span></a> say they are held back by a lack of qualified staff – while decision-makers are still struggling to fine-tune remote working models and implement new technologies in the workplace. However, Maciej Dziergwa, CEO of STX Next, believes that tech companies can survive and thrive by adapting practices to reflect the business landscape.</p> 
                  <p>Dziergwa said: “It’s important that tech leaders recognise the current economic slowdown is halting the IT industry’s momentum, and react accordingly. For instance, they shouldn’t be afraid to rein in growth plans during the height of the crisis, allowing for flexibility if the climate suddenly worsens.</p> 
                  <p>“Downsizing is a concerning trend in the tech industry ­– Amazon, Meta and Twitter are the latest high profile organisations to slash employee numbers – so it is vital that businesses grow sustainably to avoid turning to job cuts.</p> 
                  <p>“Technology leaders should also prioritise the investment of time and funds into client acquisition and retention. This involves adopting a more client-focused approach, such as travelling to meet existing or potential partners face to face. Regular contact shows a business will be far more dependable during an economic slowdown than less visible competitors.”</p> 
                  <p>To cope with the shortage of IT workers, Dziergwa believes that technology companies should seek to enhance the employee experience in order to set themselves apart from competitors.</p> 
                  <p>He added: “With skills shortages putting a strain on recruitment strategies, it’s time for business decision-makers to be more proactive to attract new talent or retain incumbent employees.</p> 
                  <p>“Flexibility is a priority for the bulk of today’s workforce, so appealing to candidates begins by ensuring that remote working models are watertight, and that staff are well-supported even if they are based at home.</p> 
                  <p>“It’s important to remember that the offer of hybrid work is now a minimum requirement for prospective staff. The tech companies that differentiate themselves will go above and beyond to meet employee needs, providing financial, emotional and educational support to guide workers through the cost-of-living crisis.”</p> 
                  <p>He concluded: “Times of economic slowdown are great opportunities to pinpoint areas for improvement and strengthen company culture. The pandemic came as a shock and stopped the world in its tracks – tech leaders must not let history repeat itself, regardless of what transpires in the coming months.”</p> 
                  <p>Technology leaders can share their thoughts on how to weather the oncoming storm by completing the CTO Survey:<a href=""https://www.thectosurvey.com/""><span> </span><span style=""color: #1155cc; text-decoration: underline;"">https://www.thectosurvey.com</span></a></p>","<em>Putting expansion plans on pause and re-thinking hiring strategies will help tech companies overcome industry struggles</em>"
"stx-next-wins-software-technology-awards-2022","Software & Technology Awards 2022: STX Next named Best Team Extension & Development Consultants","https://4542168.fs1.hubspotusercontent-na1.net/hubfs/4542168/Software%20&%20Technology%20Awards.jpg","STX Next wins Software & Technology Awards 2022","","2022-11-07T23:00:00.000Z","STX Next is delighted to inform that we have been named Best Team Extension & Development Consultants – Poland in the Software & Technology Awards 2022. ","<p style=""text-align: justify;"">Software and Technology Awards looks to acknowledge the efforts of the pioneers and disruptors of modern technology, as well as those who have sustained excellence and exhibited long term dedication to their commitment to the development and advancements in technology.</p> 
                  <p>&nbsp;</p> 
                  <p style=""text-align: justify;"">We are proud to be awarded alongside some of the most outstanding software and technology professionals from around the world. This award is a testament to the skill, ingenuity, and vision of its creators.&nbsp;</p> 
                  <p>&nbsp;</p> 
                  <p style=""text-align: justify;"">STX Next has built a strong market position through its experience in implementing high technology projects for the financial services and technologies, marketing and media, retail and consumer products, healthcare, real estate and many more segments. Creating new custom software solutions and product development for clients, STX Next has made itself an important cornerstone of digital transformations. Working with organizations of all scales and sizes, from big corporations to the most promising start-ups, we give clients access to the services of smart, reliable, and intuitive software engineers and designers.</p>","<em>STX Next is delighted to inform that we have been successful and named Best Team Extension &amp; Development Consultants – Poland in the 2022 edition of Software &amp; Technology Awards by The New World Report.&nbsp;</em>"
"stx-next-recognized-as-polands-best-b2b-companies-2022-by-clutch","STX Next recognized as one of Poland’s Best-Performing B2B Companies for 2022 by Clutch","https://4542168.fs1.hubspotusercontent-na1.net/hubfs/4542168/Clutch%20Top%20B2B%20Companies%202022%20Poland_press%20release.jpg","STX Next recognized as Poland’s Best B2B Companies 2022 by Clutch","","2022-11-02T23:00:00.000Z","After an in-depth review of our customers' feedback, STX Next has been named Poland's Best-Performing B2B Companies for 2022 by Clutch.","<p style=""text-align: justify;"">Clutch's research team examines hundreds of companies in the region, and we have been able to outperform many talented competitors. As a B2B resource, Clutch allows businesses to browse the services of various providers and ranks them based on industry data, market trends, customer reviews, and past project results.</p> 
                  <p style=""text-align: justify;""><br>At STX Next, our team of over 600 tech and business experts is aware that developing outstanding software starts long before the first line of code is written. We are Europe’s largest Python software house, but we also provide a wide range of services to meet the demands of all of our customers. For our long-term technology partners from across the globe, we work with JavaScript, React Native, Node.js, DevOps, Machine Learning, UI/UX and more to support them comprehensively and proactively in product development and the introduction of new technologies.&nbsp;</p>","<em>After an in-depth review of our customers' feedback, STX Next has been named one of Poland's Best-Performing B2B Companies for 2022 by Clutch.</em>"
"poland-is-the-emerging-tech-hub-of-europe-says-stx-next","Poland is the emerging tech hub of Europe, says STX Next","https://4542168.fs1.hubspotusercontent-na1.net/hubfs/4542168/Poland%20tech%20hub%20of%20Europe%20says%20STX%20Next.png","Poland is the emerging tech hub of Europe, says STX Next","","2022-10-02T22:00:00.000Z","In recent years, Poland has surfaced as a leading location for technology investment, start-ups and entrepreneurial talent in Europe.","<p>In recent years, Poland has surfaced as a leading location for technology investment, start-ups and entrepreneurial talent in Europe. This is according to Maciej Dziergwa, CEO of Europe’s largest Python software development company, STX Next. Dziergwa firmly believes that Poland’s recent economic growth, wealth of software development talent and appeal to venture capital firms cement its place as a promising European tech hub, and is full of optimism for its future.</p> 
                  <p>The economic growth in Poland has seen the country spearhead a series of technological innovations and advancements. Poland’s IT industry constitutes about 8% of GDP, employing over 430,000 people. Poland is the largest economy in central and eastern Europe with 30% share of total GDP and 25% of the population.</p> 
                  <p>Dziergwa said: “Poland’s status as central and eastern Europe’s technological beating heart has been well-recognised by those inside the industry for some time. As of 2022, market leaders such as Google, Samsung, Facebook, Amazon and Intel have set up shop here, alongside <span style=""color: #050505;"">more than 500 other R&amp;D facilities.</span></p> 
                  <p>“For new founders and established players, young developers and team leaders, Poland is a hotbed of opportunity. The technology market is thriving, and the country is ready to play its part in growing the global tech economy” says Dziergwa.</p> 
                  <p><span style=""color: #050505;"">The country’s collective IT expenditure <a href=""https://www.trade.gov/country-commercial-guides/poland-digital-technologies#:~:text=According%20to%20BMI%20Research%2C%20in,a%20value%20of%20%2422.3%20billion."" rel=""noopener"" target=""_blank""><span style=""color: #000000;""><span style=""color: #09b3bf;"">grew by nearly 17% in 2021</span></span></a>, totalling more than $20 billion. Below, Dziergwa outlines the factors that he believes are behind Poland’s rise as a major tech hub in Europe.</span></p> 
                  <p>&nbsp;</p>","<em>Maciej Dziergwa, CEO at STX Next explains why Poland is the perfect place for a tech company to thrive</em>"
"stx-next-wins-at-the-annual-web-excellence-awards-competition","STX Next Wins at the Annual Web Excellence Awards Competition","https://4542168.fs1.hubspotusercontent-na1.net/hubfs/4542168/Web%20Excellence%20Awards%20STX%20Next.png","STX Next Wins at the Annual Web Excellence Awards Competition","","2022-09-14T22:00:00.000Z","STX Next was recognized for their high quality with the Web Excellence Award for the Nota Nota project in Apps & Mobile | IoT category.","<p style=""text-align: justify;"">The Web Excellence Awards, a leading international interactive web awards competition, has announced the 2022 award winners to highlight this year's ""best of the best"" in web design and development.</p> 
                  <p style=""text-align: justify;"">STX Next was recognized for their high quality with the excellence award for the <a href=""https://www.behance.net/gallery/73333299/Nota-Nota-The-Experience-of-Fragrance-Design""><span>Nota Nota</span></a> project in Apps &amp; Mobile | IoT category.</p>","STX Next recognized for prestigious web design award with its project Nota Nota"
"machine-learning-is-the-future-but-is-not-without-its-challenges","Machine learning is the future, but is not without its challenges, says STX Next","https://4542168.fs1.hubspotusercontent-na1.net/hubfs/4542168/Machine%20learning%20STX%20NEXT%20(2).png","Machine Learning is the Future, But Is Not Without Its Challenges","","2022-09-12T22:00:00.000Z","Head of Machine Learning and Data Engineering at STX Next, offers advice on addressing the complexities of undertaking a machine learning project","<p>The popularity of artificial intelligence (AI) and machine learning (ML) has skyrocketed in recent years. In fact, <a href=""../../../../com/stxnext/www/cto-survey-2021-report.html""><span>STX Next’s 2021 CTO report</span></a> found that around two-thirds of businesses have now implemented ML in some form and a further three-quarters of CTOs see it as the most likely technology to come to prominence in the next two years.</p> 
                  <p>According to Krzysztof Sopyla, Head of Machine Learning and Data Engineering at&nbsp;<span style=""color: #000000;"">STX Next</span>, maximising the potential of machine learning means being fully aware of the complexity and unique challenges that come with these types of projects, and taking the necessary steps to overcome them.</p>","<em>Krzysztof Sopyla, Head of Machine Learning and Data Engineering at STX Next, offers advice on addressing the complexities of undertaking a machine learning project</em>"
"technology-businesses-have-a-duty-to-help-employees-in-energy-crisis","Technology businesses have a duty to help employees as well as themselves in energy crisis, says STX Next","https://4542168.fs1.hubspotusercontent-na1.net/hubfs/4542168/Energy%20crisis%20STX%20NEXT.webp","Technology businesses have a duty to help employees in energy crisis","","2022-08-02T22:00:00.000Z","Just as companies should support employee wellbeing in the workplace, now is the ideal time to extend this support further","<p>After the seismic shock of the pandemic, families and individuals across Europe and beyond are grappling with a once-in-a-generation energy crisis. While businesses in the technology industry are rightfully taking steps to help safeguard their organisation’s future, there is also more they can do to help their employees cope during this time of financial hardship. This is according to <a href=""../../../../com/stxnext/www/index.html"" style=""color: #0000ff;""><span>STX Next</span></a>.</p> 
                  <p>In the short term, tech companies are putting a range of policies in place to reduce their energy expenditure. These include installing modern lighting solutions such as motion sensors and timers in offices, and expanding workplace practices such as green coding. However, Maciej Dziergwa, CEO of STX Next, believes that efforts should be made to help employees on a personal level, particularly those still frequently working from home.</p> 
                  <p>Dziergwa said: “Some organisations have offered pay rises or one-off bonuses to employees to help them cope with higher bills and the impact of rampant inflation. These serve a short-term purpose, but helping employees to develop more permanent energy-saving habits will ensure they come out of this crisis in the best possible shape.</p>","<em>Just as companies should support employee wellbeing in the workplace, now is the ideal time to extend this support further</em>"
