slug,name,cover,title,place,published,metaDescription,content,intro
"stx-next-digitalises-dermatology-with-medassist","STX Next digitalises dermatology with Medassist","https://4542168.fs1.hubspotusercontent-na1.net/hubfs/4542168/medassist%20thumbnail-1.png","STX Next digitalises dermatology with Medassist","","2022-07-20T22:00:00.000Z","Medassist by STX Next makes remote medical care for skin changes and lesions easier by overhauling its web app","<p><span>Software development company and Python specialist&nbsp;</span><a href=""../../../../com/stxnext/www/index.html"" target=""_blank"" rel=""noopener""><span>STX Next</span></a><span>&nbsp;has successfully created a new web application for&nbsp;</span><a href=""https://www.stxnext.com/portfolio/medassist"" target=""_blank"" rel=""noopener""><span>Medassist</span></a><span>, a company specialising in the diagnosis of skin conditions. The app facilitates remote contact between doctors and patients, reduces waiting times and lightens workloads for medical professionals.</span></p> 
                  <p><span>The application was developed when Covid-19 was at its peak and contact between doctors and patients was limited. Many people were hesitant to visit hospitals for fear of being infected with the virus and to avoid overwhelming healthcare services.</span></p> 
                  <p><span>The resulting web application allowed doctors to continue assessing patients’ skin lesions.</span></p> 
                  <p><span><img src=""https://www.stxnext.com/hs-fs/hubfs/medassist.png?width=901&amp;name=medassist.png"" alt=""medassist"" width=""901"" loading=""lazy"" style=""width: 901px;"" srcset=""https://www.stxnext.com/hs-fs/hubfs/medassist.png?width=451&amp;name=medassist.png 451w, https://www.stxnext.com/hs-fs/hubfs/medassist.png?width=901&amp;name=medassist.png 901w, https://www.stxnext.com/hs-fs/hubfs/medassist.png?width=1352&amp;name=medassist.png 1352w, https://www.stxnext.com/hs-fs/hubfs/medassist.png?width=1802&amp;name=medassist.png 1802w, https://www.stxnext.com/hs-fs/hubfs/medassist.png?width=2253&amp;name=medassist.png 2253w, https://www.stxnext.com/hs-fs/hubfs/medassist.png?width=2703&amp;name=medassist.png 2703w"" sizes=""(max-width: 901px) 100vw, 901px""></span></p> 
                  <p>&nbsp;</p>","<em>Medassist makes remote medical care for skin changes and lesions easier by overhauling its web app</em>"
"growing-european-tech-companies-shouldnt-fear-further-international-expansion","Growing European tech companies shouldn’t fear further international expansion, says STX Next","https://4542168.fs1.hubspotusercontent-na1.net/hubfs/4542168/International%20expansion%20STX%20NEXT-1.webp","STX Next: Growing tech companies shouldn’t fear further international expansion","","2022-07-17T22:00:00.000Z","Even in an uncertain economic and political climate, technology businesses have the strength to succeed.","<p>The recent surge in economic activity brought on by an end to pandemic restrictions has been dampened somewhat by the Russia-Ukraine conflict, rising energy prices and rampant inflation. Despite these new challenges, growing technology companies across Europe should not allow this to put the brakes on their ambitions to expand internationally. This is according to STX Next.<br><br>Maciej Dziergwa, CEO of STX Next, said: “2021 was a year where the world bounced back from the turbulence of the pandemic’s early stages. The UK economy, for example, grew at its fastest pace on record over the year. Things have slowed down considerably since then, but for the tech sector, we believe that plenty of cause for optimism remains. <br><br>“We might not be quite as dependent on tech as we became in 2020, but many ways in which we embraced it – both at work and in our personal lives – have become permanent habits. Many of these behaviours won’t be significantly diminished by the energy or inflation crises, so there’s every opportunity for further international growth if successful tech companies are willing to be bold and push on with their expansion plans.”</p>","<em>Even in an uncertain economic and political climate, technology businesses have the strength to succeed</em>"
"stx-next-wins-clutch-award-top-web-custom-software-developer-poland","STX Next Wins Clutch Award for Top Web and Custom Software Developer in Poland!","https://4542168.fs1.hubspotusercontent-na1.net/hubfs/4542168/Clutch%20Top%20Developers%20Poland_blogpost.png","STX Next Wins Clutch Award for Top Web and Custom Software Developer in Poland!","","","Read how STX Next got featured as one of the top web and custom software development companies in Poland.","",""
"stx-next-featured-clutch-1000-company-again","Déjà Vu: STX Next Featured as a Clutch 1000 Company… Again!","https://4542168.fs1.hubspotusercontent-na1.net/hubfs/4542168/Deja%20vu_%20STX%20Next%20Featured%20as%20a%20Clutch%201000%20Company%20Again%201576x824.png","Déjà Vu: STX Next Featured as a Clutch 1000 Company… Again!","","","For the second year in a row, we’re one of the Clutch Global 1000, which puts us among the top 1% of B2B services providers on Clutch.","",""
"stx-next-named-top-financial-services-software-developer-clutch","STX Next Named a Top Financial Services Software Developer by Clutch","https://4542168.fs1.hubspotusercontent-na1.net/hubfs/4542168/01_01_Blogpost_Clutch_Top%20financial%20services%20software_1576x824.png","STX Next Named a Top Financial Services Software Developer by Clutch","","","STX Next’s latest Clutch award ranks us among the Top Financial Services Software Developers of 2019. Learn how we won the award and what it means for us.","",""
"7-python-powered-companies-ft1000","7 Python-Powered Companies We’re Happy to Join Among the FT1000","https://4542168.fs1.hubspotusercontent-na1.net/hubfs/4542168/STX-Next-FT-1000-1576x824.png","7 Python-Powered Companies We’re Happy to Join Among the FT1000","","","STX Next was ranked one of Europe’s fastest-growing companies on the Financial Times 1000. Here are 7 other Python-powered companies on the FT1000 ranking.","",""
