slug,name,cover,title,place,published,metaDescription,content,intro
"the-global-cto-survey-2023-released","The Global CTO Survey 2023 Released: Comprehensive Insights into Technology Leadership","https://4542168.fs1.hubspotusercontent-na1.net/hubfs/4542168/CTO_Survey_final%20(1).jpg","The Global CTO Survey 2023 Released","","2023-11-13T23:00:00.000Z","STX Next, a leading IT consulting company, is excited to announce the launch of the highly anticipated Global CTO Survey 2023.","<p style=""text-align: justify;"">This comprehensive survey, conducted in collaboration with HAYS, a renowned partner in the industry, delves deep into the heart of technology leadership, shedding light on the ever-evolving technology landscape in 2023.</p> 
                  <p style=""text-align: justify;"">STX Next created a resource that provides a comprehensive and detailed view of the challenges, trends, and strategies in the realm of technology leadership. The Global CTO Survey 2023 comprises over <strong>90 pages </strong>of insights, covering a wide array of topics through more than <strong>90 survey questions</strong>. Responses from CTOs from<strong> 6 continents </strong>have poured in, making this report a truly global representation of technology leadership.</p> 
                  <p style=""text-align: justify;"">The Global CTO Survey 2023 report offers an unparalleled opportunity for technology leaders and their teams to gain in-depth insights into the challenges and operational strategies faced by their peers. This knowledge empowers them to make informed decisions that can shape the future of their organizations.</p> 
                  <p><strong>Over 260 CTOs</strong> from around the world participated in this survey, sharing their valuable insights on crucial questions, including:</p> 
                  <ul> 
                   <li aria-level=""1"">Which AI technologies have they implemented?</li> 
                   <li aria-level=""1"">What technologies and trends they believe will gain prominence in the next 2-4 years?</li> 
                   <li aria-level=""1"">Their perspectives on the most significant cybersecurity threats.</li> 
                   <li aria-level=""1"">Strategies employed for staff motivation and engagement.</li> 
                  </ul> 
                  <p style=""text-align: justify;"">The full report, which is now <a href=""https://www.thectosurvey.com/"" rel=""noopener"" target=""_blank""><span>available for download</span></a>, contains the collective wisdom and experiences of these technology leaders, providing valuable insights that could hold the key to your next strategic move.</p>","STX Next, a leading IT consulting company, is excited to announce the launch of the highly anticipated <strong>Global CTO Survey 2023</strong>, a report that unveils the latest insights and strategic decisions of Chief Technology Officers from across the globe.&nbsp;"
"stx-next-partners-with-squirro-to-strengthen-ai-capabilities","STX Next partners with Squirro to strengthen AI capabilities","https://4542168.fs1.hubspotusercontent-na1.net/hubfs/4542168/STX%20Next%20x%20Squirro.jpg","STX Next partners with Squirro to strengthen AI capabilities","","2023-10-16T22:00:00.000Z","The partnership will enhance STX Next’s AI and data engineering offering in the DACH region and the rest of the world.","<p style=""text-align: justify;"">STX Next, a prominent IT services and consulting company, has announced a new partnership with <a href=""https://squirro.com/"" rel=""noopener"" target=""_blank"">Squirro</a>, the generative AI-powered enterprise search and insights cloud provider.<br><br>The partnership underpins STX Next’s sector-specific focus on AI and data engineering in the DACH region, and the company’s ambitions to grow its expertise in this area further on a global scale. The region has been one of particular focus for STX Next in 2023: in June this year it announced the appointment of Markus Tautz as its Managing Director for DACH.<br><br>Squirro is the generative AI-enabled semantic enterprise search and insight cloud for searching, analyzing, and interpreting unstructured data.<br><br>With that, Squirro empowers organizations to transform enterprise data into AI-driven insights and tailored recommendations. Squirro has more than ten years’ experience marrying AI, Machine Learning, Predictive Analytics, and symbolic AI - like Knowledge Graphs, known together as Composite AI.<br><br>Squirro has been recognized as a “Visionary” in the 2021 and 2022 Gartner® Magic Quadrant™ for Insight Engines and a “Strong Performer” in the 2021 Forrester Wave Cognitive Search &amp; Knowledge Discovery.<br><br>A testament to the cooperation between STX Next and Squirro is that they have already begun offering their services to the world-renowned independent private foundation, the Bertelsmann Foundation. This example vividly illustrates the unique synergy achieved through their collaboration. Both companies are leading the charge in driving digital transformation for many well-known multinational corporations, extending their expertise across various industries.<br><br>Commenting on the partnership, Dr. Dorian Selz, Co-Founder and CEO at Squirro said: ""Our partnership with STX Next is a game-changer in today's data-driven business world. In this competitive landscape, data is the key to success, and that's why we've teamed up with STX Next. Together, we're bringing cutting-edge AI technologies to empower businesses with tailored solutions and top-notch services. We focus on data analytics and insights, to increase efficiency and save operational costs. We're committed to delivering tangible value from data, bridging the gap between data and practical insights to drive business growth and innovation.""<br><br>Ronald Binkofski, CEO of STX Next said: ""We are thrilled to announce our official partnership with Squirro, a visionary leader in their field. This collaboration marks a significant milestone for STX Next as we continue our growth throughout the DACH region, Europe and globally, and we are truly grateful for the opportunity to work alongside such an innovative company.<br>&nbsp;<br>“Together, we envision a future where our combined expertise will help customers break new ground in terms of how they manage and utilize their data. We want to help transform not just the businesses we work with, but the industries in which they operate, and believe this partnership will help us achieve this.""</p>","The partnership will enhance STX Next’s AI and data engineering offering in the DACH region and the rest of the world."
"stx-next-announces-strategic-partnership-with-aws-as-official-partner","STX Next announces strategic partnership with Amazon Web Services (AWS) as official partner","https://4542168.fs1.hubspotusercontent-na1.net/hubfs/4542168/Projekt%20bez%20nazwy.png","STX NEXT Announces Strategic Partnership with AWS as Official Partner","","2023-09-13T22:00:00.000Z","STX Next, a leading IT consulting company, announces its official partnership with AWS, the world's most comprehensive and broadly adopted Cloud platform.","<p style=""text-align: justify;"">This strategic collaboration marks a significant milestone for STX Next, highlighting its commitment to delivering cutting-edge solutions and leveraging the power of AWS to drive innovation and scalability. As an official AWS Partner, STX Next is well-positioned to enhance its Cloud-based offerings, providing clients with unparalleled access to AWS's extensive suite of services.<br><br>Key Highlights of the Partnership:</p>","STX Next, a leading software development company specializing in Python and AI technologies, proudly announces its official partnership with Amazon Web Services (AWS), the world's most comprehensive and broadly adopted Cloud platform."
"the-role-of-ai-and-machine-learning-in-driving-efficiency-and-innovation","Automating FinTech: The role of AI and Machine Learning in driving efficiency and innovation","https://4542168.fs1.hubspotusercontent-na1.net/hubfs/4542168/blog-post-graphic-Risks-in-Machine-Learning-Projects-and-How-to-Avoid-Them.png","The role of AI and machine learning in driving efficiency and innovation","","2023-09-29T22:00:00.000Z","AI and ML algorithms are automating processes across the fintech sector, increasing efficiency, scalability and accuracy, according to CEO at STX Next","<p style=""text-align: justify;"">Artificial intelligence (AI) and Machine Learning (ML) uptake is expanding across almost every industry, but this technology has had a particularly profound influence in the fintech and financial services sector.<br><br>This assertion is backed up by recent research. McKinsey’s ‘State of AI in 2023’ report revealed that <a href=""https://www.mckinsey.com/capabilities/quantumblack/our-insights/the-state-of-ai-in-2023-generative-ais-breakout-year"" rel=""noopener"">55% of companies</a> have now integrated AI in some form into their day-to-day business functions, with this figure <a href=""https://www.bankofengland.co.uk/report/2022/machine-learning-in-uk-financial-services#:~:text=The%20number%20of%20UK%20financial,widespread%20across%20more%20business%20areas."" rel=""noopener"" target=""_blank"">rising to 72%</a> when we look at fintech and financial services firms in isolation.<br><br>Vital fintech operations such as fraud detection, risk assessment and personalised recommendations can all be automated with AI and ML, which is why we’re seeing the popularity of this technology grow throughout the industry.</p>","<span style=""font-size: 18px;""><em>AI and ML algorithms are automating processes across the fintech sector, increasing efficiency, scalability and accuracy, according to Ronald Binkofski, CEO at STX Next</em></span>"
"stx-next-is-one-of-the-most-reviewed-web-development-companies","STX Next Is One of The Most Reviewed Web Development Companies in Poznan According to The Manifest","https://4542168.fs1.hubspotusercontent-na1.net/hubfs/4542168/Clutch%20Web%20Dev%20Manifest%202023.png","STX Next Is One of The Most Reviewed Web Development Companies","","2023-08-17T22:00:00.000Z","Web development is an essential part of running a modern business. This is why web development agencies created a highly competitive industry.","<p style=""text-align: justify;"">Web development is an essential part of running a modern business. Online presence is one of the most important things to get right to build and maintain a loyal audience. This is why <a href=""https://clutch.co/web-developers/pricing"" rel=""noopener"" target=""_blank"">web development</a> agencies have multiplied worldwide, creating a highly competitive industry.</p> 
                  <p style=""text-align: justify;""><br>For this reason, we at STX Next are proud to announce that we’ve been counted among the top-tier of the industry by none other than our clients themselves. This is because we were recently included in a list of more reviewed web developers by The Manifest.<br><br>For those unfamiliar with their work, The Manifest is <a href=""https://themanifest.com/pl/web-development/companies/poznan?utm_source=directory&amp;utm_medium=blog&amp;utm_campaign=TM+Awards"" rel=""noopener"" target=""_blank"">a B2B platform</a> that helps companies find and connect with specialized vendors with the skills to complete their projects. They do this by combining their feedback-based review system with customer service-focused awards.<br><br>This means that when a company is included in one of The Manifest’s lists, they are among the select few to impress clients more than the rest of the industry. This system is helping even the playing field for SMEs competing against established brands with large marketing budgets.<br><br>We firmly believe that exceptional software results from meticulous planning and a deep understanding of business needs. This belief is embedded in our approach, as we initiate our development process with comprehensive Discovery workshops, UX/UI design, web graphic design, and thorough business needs analysis.<br><br>If you want to learn more about STX Next and our services, browse our website. When you find something interesting you want to apply to your operations of platforms, don’t hesitate to <a href=""/contact/"" rel=""noopener"">contact our team</a> at your earliest convenience. We will work closely with you to ensure your unique vision and voice manifest into the final product.</p>","Poznań, August 18, 2023"
"stx-next-appoints-michael-beck-as-us-managing-director","STX Next appoints Michael Beck as US Managing Director","https://4542168.fs1.hubspotusercontent-na1.net/hubfs/4542168/Best%20Tactics%20in%20Successful%20Business%20Negotiation%20for%20Technical%20Managers.jpg","STX Next appoints Michael Beck as US Managing Director","","2023-07-26T22:00:00.000Z","The addition of Beck to STX Next’s senior leadership team signals the company’s commitment to US expansion","<p><a href=""../../../../com/stxnext/www/index.html""><span>STX Next</span></a>, a prominent IT services and consulting company, has recently named Michael Beck as the US Managing Director, reaffirming the organization's dedication to expanding its operations in the United States. Beck, who possesses over two decades of experience in the US tech sector, will assume a central role in broadening STX Next's customer base in the region and solidifying the company's long-term growth strategy.</p> 
                  <p>Prior to joining STX Next, Beck served as the Vice President of Sales &amp; Client Management at Unisys for more than seven years, focusing primarily on financial and commercial services. He has also held significant technical positions at renowned corporations such as IBM, Dell, and Capgemini. In his new role as the US Managing Director, Beck will spearhead the expansion of STX Next's commercial footprint and oversee day-to-day operations.</p>","Poznań, July 27, 2023"
"stx-next-appoints-markus-tautz-as-dach-managing-director-and-partners-with-squirro","STX Next appoints Markus Tautz as DACH Managing Director and partners with Squirro","https://4542168.fs1.hubspotusercontent-na1.net/hubfs/4542168/top-cto-tech-blogs.jpg","STX Next appoints Markus Tautz as DACH Managing Director","","2023-06-26T22:00:00.000Z","STX Next’s latest customer win and appointment of Tautz highlights the company’s expansion in the DACH region and commitment to AI and data engineering","STX Next, a leading IT services and consulting company, has announced the appointment of Markus Tautz as DACH Managing Director. Tautz is already driving the company’s growth in the region through the onboarding of Swiss company Squirro.
                  <br>
                  <br>Squirro is a company that links and analyses data to provide new insights as a basis for decision-making. The partnership underlines STX Next’s sector-specific focus on AI and data engineering in the DACH region, and the company’s ambitions to grow in this area on a global scale.
                  <br>
                  <br>Tautz’s extensive experience aligns with STX Next’s plans to partner with technological innovators, having worked in the tech industry for over 13 years − including four years as Account Director for software and development sales at Objectivity. As DACH Managing Director, Tautz is responsible for delivering STX Next’s go-to-market strategy across the DACH and European region, while expanding the company’s customer base.","Poznań, June 27, 2023"
"tech-professionals-want-to-go-further-with-ai","Tech professionals want to go further with AI, but need better support to develop skills, says STX Next research","https://4542168.fs1.hubspotusercontent-na1.net/hubfs/4542168/pillar_page_ml_linkedin_promotional_image_vol02_1200x628.png","Tech professionals want to go further with AI","","2023-05-26T22:00:00.000Z","25% of software developers want to improve their AI and machine learning capabilities, but hurdles to achieving this remain","Research from STX Next, Europe’s largest software development company specialising in the Python programming language, has found that 29% of developers have completed courses in AI and machine learning (ML), making it the third-most popular area for training behind web development (67%) and software development (65%).
                  <br>
                  <br>Despite this, only 6% expect to see more AI or ML tools and functionality in future versions of Python, underlining how more needs to be done to support software developers in their current and future AI and ML projects.
                  <br>
                  <br>The findings were taken from STX Next’s 2023 Python Tech Radar report, which collected insights from a range of Python developers. Other key figures include:
                  <br>
                  <br> 
                  <ul> 
                   <li>&nbsp;17% of respondents see AI, ML, data engineering and data science as the next big things in Python, ranking higher than any other area, including performance (15%)</li> 
                   <li>36% are undecided on what the next big things in Python will be, but are curious to find out</li> 
                   <li>25% want to enhance their AI and ML skills, only ranking behind more established areas such as software architecture (76%), software development (52%) and leadership (28%)</li> 
                  </ul> 
                  <p><br>Ronald Binkofski, CEO at STX Next, said: “Stories about AI are dominating the news schedule at the moment, with much of the debate focusing on the future of the technology and whether regulation is needed to keep its progress under control.<br><br>“In any case, AI and ML are here to stay; there is a strong appetite among software developers for building and growing their skills in this area, and they recognise its potential in helping them complete more innovative and ambitious projects.</p> 
                  <p><br>“However, there is still some ground to make up to ensure that developers have the tools at their disposal to elevate their skills to a new level. Despite Python’s status as the go-to&nbsp; programming language for AI research and the practical application of ML and data science, it still has room for improvement in terms of functionality.”<br><br>“To meet this demand, future updates to Python – and other popular programming languages – should focus on implementing improved AI and ML tools as a matter of course. Updates to other areas such as performance and security are always crucial, but making it easier to carry out AI-related projects has to be a priority from now on as well.”<br><br>Binkofski concluded: “On a more general level, it’s also vital that developers are given the training they need to deepen their AI and ML skills, outside of the programming process itself. If organisations emphasise holistic training for their employees in this area – covering<br>everything from wider AI-related concepts, all the way through to the intricacies of coding for AI – they will set themselves up for a successful future.”</p>","Poznań, May 27, 2023"
"stx-next-joins-onenda","STX Next Joins oneNDA to Streamline Legal Processes and Accelerate Business Deals","https://4542168.fs1.hubspotusercontent-na1.net/hubfs/4542168/ONE%20NDA.png","STX Next Joins oneNDA to Streamline Legal Processes","","2023-05-22T22:00:00.000Z","STX Next is thrilled to announce its partnership with oneNDA, a standardized, open-source Non-Disclosure Agreement platform. ","<p style=""text-align: justify;"">STX Next, a leading IT consulting firm and Europe's largest Python software house, is thrilled to announce its partnership with oneNDA, a standardized, open-source Non-Disclosure Agreement (NDA) platform. By embracing oneNDA, STX Next aims to revolutionize its legal operations, boost transparency, and expedite business transactions.</p> 
                  <p style=""text-align: justify;"">Traditionally, navigating NDAs has been a labyrinthine task for organizations, with each party employing their own templates, resulting in time-consuming battles of forms and repetitive negotiations. STX Next recognizes the need for a more efficient approach that optimizes resources and expedites deal closures.</p> 
                  <p style=""text-align: justify;"">With the implementation of oneNDA, STX Next aims to put an end to this protracted ordeal. By adopting a standardized, balanced, and open-source NDA solution, the company empowers its business, sales, and legal teams to focus on what truly matters – forging meaningful connections, pursuing innovative ventures, and driving growth.</p>","Poznań, May 23, 2023"
"stx-next-appoints-matthew-ziff-as-uk-managing-director","STX Next appoints Matthew Ziff as UK Managing Director to drive expansion in the region","https://4542168.fs1.hubspotusercontent-na1.net/hubfs/4542168/Top%209%20Noteworthy%20UK%20Companies%20Using%20Python.jpg","STX Next appoints Matthew Ziff as UK Managing Director","","2023-04-27T22:00:00.000Z","Matt Ziff is focused on increasing STX Next’s UK market share and growing its profile in the region.","<p style=""text-align: justify;"">STX Next, a leading IT services and consulting company, has announced the appointment of Matthew Ziff as UK Managing Director. Ziff brings over a decade of sector-specific experience to the STX Next leadership team, and will support the business’ plans to scale in the UK.<br><br>Ziff joined STX Next in September 2022 and has presided over a busy period for the company’s UK expansion. Prior to his role at STX Next, Ziff spent two years as Global Head of Sales at GlobalData. As UK Managing Director, Ziff is responsible for overseeing operations, developing new business opportunities, and building relationships with clients. His overall aim is to drive STX Next’s growth in the region and expand its customer base.<br><br>Ziff said: “I am delighted to have the opportunity to raise STX Next’s profile in the UK market, and my early days in the job have already yielded some fantastic results. STX Next has built a reputation for excellence in its native Poland, so I’m really excited to see what the coming months hold for the UK team as we continue our expansion. We’re confident that we can replicate the successes STX Next has already achieved elsewhere in Europe.”</p>","Poznań, April 28, 2023"
"soft-skills-make-all-the-difference","Soft skills make all the difference: a third of programmers say problem-solving skills are their most important asset","https://4542168.fs1.hubspotusercontent-na1.net/hubfs/4542168/why-python-should-be-technology-choice-your-fintech.jpg","Soft skills make all the difference","","2023-03-19T23:00:00.000Z","Research from STX Next has found that 32% of programmers say an ability to think logically, critically and analytically is the key to becoming a great Python developer. ","<p style=""text-align: justify;"">Research from STX Next, Europe’s largest software development company specialising in the Python programming language, has found that 32% of programmers say an ability to think logically, critically and analytically is the key to becoming a great Python developer.&nbsp;</p>","Poznań, March 20, 2023"
