slug,name,cover,title,place,published,metaDescription,content,intro
"clutch-names-stx-next-as-one-of-the-game-changing-software-developers-in-houston","Clutch Names STX Next as one of the Game-Changing Software Developers in Houston","https://4542168.fs1.hubspotusercontent-na1.net/hubfs/4542168/Clutch%20Award%20Huston.png","Clutch Names STX Next as one of the Game-Changing Software Developers in Houston","","2024-04-02T22:00:00.000Z","Software solutions and products have been revolutionizing the world!","<p style=""text-align: justify;"">We are a world leader in IT consulting with a focus on providing innovative software solutions driven by artificial intelligence. Our services are in line with the most recent market difficulties and leadership initiatives thanks to the insights of over 500 CTOs, who support our expertise.<br><br>Our company was founded on a solid Python legacy. We serve clients from our bases in Mexico and Poland, offering Data and Machine Learning solutions that are seamlessly integrated into contemporary cloud architecture and feature outstanding User Experience and Innovative Design.<br><br>At STX Next, we are really proud of the many years we have spent building partnerships with companies from all around the globe. We are able to assist a variety of businesses, from start-ups to major organizations, because of our commitment to client satisfaction. To add, we are also proud to share with you that we’ve been crowned as one of the game-changing <span style=""color: #09b3bf;""><a href=""https://clutch.co/developers/houston?utm_source=directory&amp;utm_medium=blog&amp;utm_campaign=surgical"" rel=""noopener"" target=""_blank"" style=""color: #09b3bf;"">Software Developers in Houston</a></span> by none other than Clutch!&nbsp;<br><br>Clutch is a B2B ratings and reviews platform based in Washington, DC. They evaluate technology service and solutions companies based on the quality of work, thought leadership, and client reviews. A rapidly expanding startup, Clutch has become the go-to resource in the agency space.<br><br>We would also like to take this opportunity to thank our clients and partners for their support! As a matter of fact, here are some of the best reviews from you guys from our Clutch profile to help us celebrate this milestone:<br><br>“What stood out most about STX was their exceptional commitment to client satisfaction and their collaborative approach. They worked closely with us at every step, ensuring that all our needs were met and going above and beyond to keep us happy.&nbsp;<br><br>Their company culture resonated deeply with ours, creating a harmonious and productive working relationship. Additionally, their ongoing support and proactive check-ins to ensure everything is running smoothly have been particularly noteworthy. This level of personalized attention and care in fostering a positive client experience is what makes STX truly unique and impressive.” Josh Ungheanu, Project Manager at CloudCompli<br><br>“I have been impressed with their ability to think outside the box and come up with new, unique solutions to problems that we have. They have taken the time to truly understand our product, audience, and needs in order to provide us with the best possible solutions. In addition, they have a wide range of specialities on their team, which allows us to pull in additional individuals while we tackle specific tasks. This was extremely helpful as we were building our search engine.&nbsp;<br><br>We were able to work with a search expert that guided us through the process, gave us recommendations, and was open to hearing our feedback as well. Our STX Next team cares about our product as if it were their own and is always striving to create the best possible product.” Director, VetMedux<br><br><span style=""color: #09b3bf;""><a href=""../../../../com/stxnext/www/hire-us.html"" rel=""noopener"" target=""_blank"" style=""color: #09b3bf;"">Connect with our team</a></span> today! We’d love to be part of your next project.</p>","Software solutions and products have been revolutionizing the world! A lot of the top businesses, companies, and organizations in the world are utilizing these new technologies in order to deliver impactful services and products in the market. If you want to learn more about the development industry and its processes, then STX Next is here for you!&nbsp;"
"stx-next-launches-ai-powered-virtual-development-solution-deepnext","STX Next launches AI-powered virtual development solution DeepNext","https://4542168.fs1.hubspotusercontent-na1.net/hubfs/4542168/Link_DeepNext.jpg","STX Next launches AI-powered virtual development solution DeepNext","","2024-03-14T23:00:00.000Z","DeepNext grants businesses access to a team of virtual developers that can perform tests, write code from scratch and complete API integrations","<p style=""text-align: justify;"">STX Next, a global leader in IT consulting, today announced the launch of DeepNext, an AI-powered virtual development solution designed to assist businesses with the maintenance and growth of their applications.<br><br>DeepNext digitises the programming process, supported by an AI agent that can write entire applications with the human developer transitioning to the role of AI supervisors. The solution acts as an autonomous AI developer, project manager or QA engineer, handling tasks with high levels of complexity all the way to deployment.<br><br>Commenting on the launch of DeepNext, Bartek Roszak, Head of AI at STX Next, said: “STX Next has embraced its heritage as a Python powerhouse to architect a groundbreaking AI solution. DeepNext represents a groundbreaking shift in AI, moving the paradigm from AI as a support mechanism for human tasks to a collaborative framework where humans take on a supervisory role.<br><br>“DeepNext covers all aspects of software development, providing intelligent and intuitive back-end solutions that deliver strong functionality. One of its main assets is its reliability, as the virtual developers code with precision and testers ensure seamless functionality.<br><br>“The system turns the developer into an AI operator and supervisor, enabling DeepNext to function independently. As a result, the human element in the process is focused on overseeing and monitoring the virtual developer’s performance, as opposed to directly getting involved in the technical process. We plan to equip our own development teams with virtual developers or AI agents, building another layer of reliability and accuracy into all the work that we do.<br><br>“DeepNext can be applied to any industry and project type. If correctly deployed, DeepNext can improve a company’s development speed by up to ten times.”<br><br>Roszak concluded: “We’re proud to celebrate our ethos and legacy as a technological leader and innovator with the launch of DeepNext. STX Next truly believes that this system is the future of software development and the key to unlocking efficient development for businesses across practically every sector.”</p> 
                  <p style=""text-align: justify;"">For more information go to: https://www.deepnext.ai/&nbsp;</p>","DeepNext grants businesses access to a team of virtual developers that can perform tests, write code from scratch and complete API integrations"
"stx-next-targets-ai-powered-expansion-in-2024","STX Next targets AI-powered expansion in 2024","https://4542168.fs1.hubspotusercontent-na1.net/hubfs/4542168/AI_Expansion_1200x628.png","STX Next targets AI-powered expansion in 2024","","2024-02-14T23:00:00.000Z","Custom AI solutions, AI consulting services and the appointment of a new head of AI are all driving STX Next’s strategic pivot to an AI-centric culture","<p style=""text-align: justify;"">STX Next, a global leader in IT consulting, has reaffirmed its commitment to advancing artificial intelligence (AI) technology by placing AI at the forefront of all of its offerings. The move increases the adaptability and resilience of STX Next’s services, while positioning the company at the cutting edge of the technology sector.&nbsp;<br><br>This is a continuation of STX Next’s transition to company-wide AI adoption, following the appointment of Bartek Roszak as Head of AI and the announcement of a partnership with Squirro, the generative AI-powered enterprise search and insights cloud provider, last year.<br><br>Commenting on the decision to focus on AI, Łukasz Koczwara, COO at STX Next, said: “STX Next’s rich history and reputation as a Python powerhouse has laid the foundation for our AI transition, and underscores the company’s philosophy of placing itself at the centre of global innovation and technological growth.<br><br>“As part of our new strategy, we are offering AI solutions and consulting services to all our customers, tailoring every recommendation to align with each client’s progress on their digital journey. We’re also intent on delivering balanced and ethical AI deployment, marrying mature AI services that bring instant returns with generative AI technologies that yield rewards further down the line.<br><br>“STX Next has invested heavily to ensure that we capitalise on the growth of AI, most notably through the appointment of Bartek Roszak. As a result, we now offer AI consulting services to a range of key sectors, including healthcare, fintech, logistics, e-commerce and edtech.<br><br>“Partnering with Squirro was integral in enhancing the level of service we’re able to offer our clients, as Squirro delivers insights that increase the quality, speed and efficiency of AI development within our business. We’re running further initiatives in 2024 aimed at educating our customers about the many benefits of AI, such as the launch of our AI academy and a new AI webinar series.”<br><br>Koczwara concluded: “Over the next twelve months, STX Next plans to establish itself as a leader in AI-driven innovation and digital transformation. Through sustainable growth, a host of customer success stories and breakthrough AI achievements, we hope to offer the most advanced standard of service possible for clients across all sectors.”</p>","Custom AI solutions, AI consulting services and the appointment of a new head of AI are all driving STX Next’s strategic pivot to an AI-centric culture"
"stx-next-receives-iso-27001-certification","STX Next Receives ISO 27001 Certification for Enhanced Information Security","https://4542168.fs1.hubspotusercontent-na1.net/hubfs/4542168/01_ISO%20Cetriticate_1200x627%20(1).png","STX Next Receives ISO 27001 Certification","","2024-01-21T23:00:00.000Z","STX Next is proud to announce that it has earned the ISO 27001 certification, underscoring its dedication to high-quality information security management.
","<p style=""text-align: justify;"">ISO 27001 is an international information security standard that mandates a systematic approach to managing sensitive company and customer information. The certification indicates that STX Next adheres to rigorous practices in risk management, security policy, auditing, and continuous improvement of security processes.<br><br>Krzysztof Olejniczak, the company's Chief Information Security Officer, welcomed the certification, stating, ""I am immensely proud of the entire STX Next team and the result achieved. Our way of working is primarily based on an agile approach to project delivery, and such an approach does not really align well with the requirements of standards or documentation requirements. Therefore, we had to find our own way to combine the requirements of the standard and documentation duties without compromising the agility of the Organization”.<br><br>In addition, Olejniczak added a further assurance, ""An accredited certificate issued by an organization like Dekra confirms that it is possible to combine the agile world of software development with the world of regulatory or compliance requirements. It also confirms that the solutions we have designed can be the foundation for further development and the creation of safer and better solutions for our Clients. ISO 27001 is just the first step, and our plans are very ambitious.""<br><br>The company has a history of committing to security, actively updating defenses against ever-evolving threats, and maintaining industry best practices. Attaining the ISO 27001 certification marks a significant achievement in STX Next's ongoing commitment to superior security management, instilling greater confidence in clients that their data is protected at the highest level.</p>","STX Next, a global IT consulting company providing customer-focused software services, is proud to announce that it has earned the ISO 27001 certification, underscoring its dedication to high-quality information security management."
"almost-half-of-businesses-have-now-implemented-machine-learning","Almost half of businesses have now implemented Machine Learning, says STX Next research","https://4542168.fs1.hubspotusercontent-na1.net/hubfs/4542168/440_Managing_machine_learning_projects-min.png","Almost half of businesses have now implemented machine learning","","2024-01-04T23:00:00.000Z","Machine learning’s popularity looks set to continue with 66% of CTOs predicting it will become much more prominent at their business in the next 2-4 years","<p style=""text-align: justify;""><a href=""https://www.thectosurvey.com/"" rel=""noopener"">Research</a> from STX Next, Europe’s largest software development company specialising in Python, has found that <strong>47% of businesses have now implemented Machine Learning (ML)</strong> into business processes. Despite this growth in popularity of artificial intelligence (AI) and ML, further growth could be limited without investment in specialised technical teams to drive integration.<br>&nbsp;<br>Despite AI and ML’s undoubted popularity, the survey also revealed that 50% of CTOs do not have a single member of staff employed in an AI, ML or data science role at present, with 41% of technical leaders saying that their business hadn’t implemented any AI technologies at all. This underlines the scale of the progress that still needs to be made.<br>&nbsp;<br>The findings were taken from STX Next’s 2023 Global CTO Survey, which surveyed 500 global CTOs about the biggest challenges facing their organisation. Other key findings from the research included:</p> 
                  <p style=""text-align: justify;""><br>The most common AI solution within businesses at present is image detection/segmentation with 23%, followed by recommendation systems at 20% and optical character or text recognition at 19%.</p> 
                  <p style=""text-align: justify;""><br>24% of companies have now implemented natural language processing at their business and 22% say that they’ve implemented deep learning.</p> 
                  <p style=""text-align: justify;""><br>Despite AI’s rapid growth, just a quarter of companies have a separate AI/Data division and 38% have between just one and five team members in a dedicated AI/ML or data science role.</p> 
                  <p style=""text-align: justify;""><br>Bartek Roszak, Head of AI at STX Next said: “AI’s popularity this year has been driven largely by the success of large language models like ChatGPT. However, AI has many use cases beyond models like these and can support many business functions. In 2024, we hope to see an increase in uptake of AI and ML in other business processes.</p> 
                  <p style=""text-align: justify;""><br>“That said, the existing applications of AI that the survey uncovered are largely unsurprising, as AI’s ability to tackle repetitive processes and recognise patterns within images and text is clear and evident to those working in technical roles. What is surprising is that these are still only adopted by a quarter of businesses. AI can and will revolutionise many industries, but there is still work to be done in educating the market on its capabilities.</p> 
                  <p style=""text-align: justify;""><br>“Our survey results have also revealed that while many leaders acknowledge AI’s potential, there is still a need for more investment in specialised resources to support its development. Implementing machine learning in one form or another will soon be crucial in keeping pace with changes in the industry and meeting customer expectations.&nbsp;</p> 
                  <p style=""text-align: justify;""><br>“This will no doubt become more prominent over the next year and beyond as organisations look for more ways to economically and efficiently scale their business and tackle new challenges. In many cases, leaders will need to assess the extent to which off-the-shelf ML solutions can support their businesses, and work out how much they need to invest in R&amp;D to deliver the required level of expertise.</p> 
                  <p style=""text-align: justify;""><br>“AI and ML’s popularity shows no &nbsp;sign of slowing over the coming twelve months. CTOs should embrace it’s potential, balancing the needs of the business with the unique needs of clients and customers. Those that are able to leverage its potential by enhancing their skillsets will reap the rewards in 2024.”</p>","Machine Learning’s popularity looks set to continue with 66% of CTOs predicting it will become much more prominent at their business in the next two to four years"
"stx-next-partners-with-seerene-to-enhance-software-development","STX Next partners with Seerene to enhance software development and engineering delivery","https://4542168.fs1.hubspotusercontent-na1.net/hubfs/4542168/Partnership%20with%20Seerene.png","STX Next partners with Seerene to enhance software development","","2023-12-04T23:00:00.000Z","The partnership will strengthen STX Next’s offering with the support of AI-enabled software development process analytics.","<p style=""text-align: justify;"">STX Next, a prominent IT services and consulting company, has announced a new partnership with <a href=""https://www.seerene.com/"" rel=""noopener"" target=""_blank"">Seerene</a>, the first integrated software development process mining platform for the end-to-end management of software systems.<br><br>The partnership underscores STX Next’s commitment to offering exceptional digital services to its customers on a global scale. The partnership will allow STX Next to further increase the complexity and scope of its offering, accessing insights to enable higher levels of quality, speed and efficiency in software development within businesses.<br><br>Based in Potsdam, Germany, Seerene's software analytics platform leverages artificial intelligence (AI) and machine learning (ML) to provide actionable insights into software development processes for teams to enhance performance. The analytics platform incorporates all phases of the software development and delivery process, integrating all available data from tools, methods, and metrics into Seerene’s Digital Boardroom.<br><br>Seerene originated from the Hasso Plattner Institute (HPI) and is built on more than 15 years of academic research into how data on software development processes can be analysed, visualised, and understood. Dr. Johannes Bohnet, co-founder and CEO of Seerene, led a research group at the HPI that investigated the concepts and techniques of software maps as a starting point for visual software analytics that now forms an integral part of Seerene’s offering.<br><br>Commenting on the partnership, Bohnet said: “STX Next boasts a rich and established history of software excellence, demonstrating a proven track record over the years. Our new collaboration with STX Next not only solidifies this tradition but also ensures customers a heightened standard of quality software. This partnership is founded on principles of transparency, offering a comprehensive view into the intricacies of software development processes and existing code bases. Aligned in our objectives and fueled by a mutual commitment to excellence, the synergy between Seerene and STX Next promises to deliver unparalleled value to our clients.<br><br>Ronald Binkofski, CEO at STX Next said: “Seerene’s expertise and offering will be invaluable to our teams and customers, and no doubt enhance the services that we can deliver for our clients. We’re committed to improving and maintaining our exceptional standards and the additional insights offered by Seerene’s capabilities are crucial to achieving that aim.<br><br>“We’re thrilled to announce this partnership, which aligns well with our own objectives and emphasis on collaboration with like-minded organisations. As a company we are champions of technology’s potential to transform businesses, and we look forward to leveraging the Seerene platform’s capabilities in our work with customers.”</p>","The partnership will strengthen STX Next’s offering with the support of AI-enabled software development process analytics."
"clutch-recognizes-stx-next-as-game-changing-web-developers-in-germany","Clutch Recognizes STX Next as one of the Game-Changing Web Developers in Germany","https://4542168.fs1.hubspotusercontent-na1.net/hubfs/4542168/Clutch%20Award%20Germany.jpg","Clutch Recognizes STX Next as Game-Changing Web Developers in Germany","","2023-11-15T23:00:00.000Z","Get to know more about websites and how you can create your own by partnering with STX Next today.
","<p style=""text-align: justify;"">There are many reasons why you should consider creating a website, but one of the biggest reasons is the ability to create a robust digital presence. Yes, there are social media platforms where you can create profiles for your brand or business, but a website is so much more than just another page to like or follow. Get to know more about websites and how you can create your own by partnering with STX Next today.<br><br>Not only are we the biggest Python software company in Europe, but STX Next is also a prominent voice in IT consulting, offering a potent fusion of knowledge in Artificial Intelligence, Data Engineering, and Cloud technologies. With the support of our strong team of more than 500 accomplished experts, we proudly service our international customers from our home bases in Mexico and Poland.<br><br>Our skill pool, which includes Product Designers, QA Automation Engineers, Cloud and Machine Learning Architects, Data Engineers, and Business Communication Specialists, is what makes us strong. With all of this being said, we are proud to announce that our company has been recently acknowledged as one of the game-changing Web Developers in Germany by none other than Clutch!&nbsp;<br><br>Clutch is the leading ratings and reviews platform for IT, marketing, and business service providers. Each month, over half a million buyers and sellers of services use the Clutch platform, and the user base is growing by over 50% a year. Clutch has been recognized by Inc. Magazine as one of the 500 fastest-growing companies in the U.S. and has been listed as a top 50 startup by LinkedIn.<br><br>We are honored to be part of this list and to be recognized as one of the movers and shakers in the local industry. Of course, we couldn’t have done it without the support of our clients! That’s why to celebrate this award, we decided to showcase some of the best reviews and testimonials from you guys, here they are:<br><br>“Our STX Next developer was amazing. She was incredibly capable across various facets we needed, and if she was ever outside of her comfort zone, it seemed the STX Platform was there to support her -- she was able to ask other STX developers or experts about topics she was working on for us.” CTO, Audio Content Generation Company<br><br>“STX Next is really transparent. Moreover, they have great engineers who work really fast. Thanks to the quality of their work, we don’t have a lot of iteration, which facilitates the fast pace. From day one, STX Next has made things really easy for me. Their engineers have been able to work with our internal engineers without any issues.” Executive, Boopos<br><br>Let’s talk about your project! Your project holds a world of insights that we're eager to explore. Describe the purpose, scope, and unique approach that sets your project apart.<br><br></p>","Poznań, November 16 2023"
